{
  "schema": "maintenance.execution/1",
  "packageSourceRevision": "a4163559a2e20dddc1a1bb0869a06e42372994a1",
  "packageRoot": "../../../../../packages/maintenance-bench",
  "settings": {
    "path": "development.settings.json",
    "sha256": "5807c2697de74c0d84902c3d177584ac84aab652c6810e7012ae9cff1d30e4a4"
  },
  "analysis": {
    "path": "../../../../../packages/maintenance-bench/ledger_report.ail",
    "sha256": "0b1a57857edeb0e211488a6821feebf0fd41dc4123ef162ed32fc29d80b2aa0b"
  },
  "toolchains": [
    {
      "language": "ailang",
      "command": [
        "ailang"
      ],
      "version": "AILANG v0.54.18\nCommit: cd33d05\nFull:   cd33d050b2276633c82624453309ebf7fcea9e2f\nBuilt:  2026-10-23_11:36:25\n\nThe AI-First Programming Language\nCopyright (c) 2025-2026",
      "evidence": {
        "path": "development.ailang-toolchain.json",
        "sha256": "cb51e95144e74f4ce1966e3576b4737d5f8eff89aa8675b4d27fe41309920aac"
      }
    },
    {
      "language": "python",
      "command": [
        "python3"
      ],
      "version": "Python 3.13.7",
      "evidence": {
        "path": "development.python-toolchain.json",
        "sha256": "04a180787aceffff6b0404e075b8a5bc384ccb44849fc47d2ebf324425c0c252"
      }
    }
  ],
  "trajectories": [
    {
      "id": "resource-ownership-1-ailang",
      "starter": [
        {
          "path": "../resource-ownership/starter/ailang/AGENT.md",
          "destination": "AGENT.md",
          "sha256": "30a1df33ea71c44469a18f8c1c8bec23af47278dac7fb10209bf26747a9f730a",
          "executable": false
        },
        {
          "path": "../resource-ownership/starter/ailang/CHANGELOG.md",
          "destination": "CHANGELOG.md",
          "sha256": "9964284599b923be6c8e68d6cf999380f94db3a14313f21ba0d245d167d29499",
          "executable": false
        },
        {
          "path": "../resource-ownership/starter/ailang/_smoke.ail",
          "destination": "_smoke.ail",
          "sha256": "04fa53310f9fd5e148c3b9cdaaf03b2d3d9ca91e0a50623ff1288807089e1b65",
          "executable": false
        },
        {
          "path": "../resource-ownership/starter/ailang/ailang.lock",
          "destination": "ailang.lock",
          "sha256": "0d705d8314022eed9cf40f9c9bd9ef2ffb4f2337af234e4a6bb0b1ff3f9c07cf",
          "executable": false
        },
        {
          "path": "../resource-ownership/starter/ailang/ailang.toml",
          "destination": "ailang.toml",
          "sha256": "33cfa0acf333665ede3cafaffb9faf10aea2fcb58826c5e33ce2b52cd5667231",
          "executable": false
        },
        {
          "path": "../resource-ownership/starter/ailang/engine.ail",
          "destination": "engine.ail",
          "sha256": "55843394f4906a7b04e78e64d086ff22df284b53171cf4e7fe4128b82a807bf4",
          "executable": false
        },
        {
          "path": "../resource-ownership/starter/ailang/engine_test.ail",
          "destination": "engine_test.ail",
          "sha256": "38e35ac48edcf3f721f831c13aa242bcc61d50a1f9f3f24482cc75780b059342",
          "executable": false
        },
        {
          "path": "../resource-ownership/starter/ailang/examples/qualify_f1.ail",
          "destination": "examples/qualify_f1.ail",
          "sha256": "060ff05484b9774cb56a1aeb3480c3ec5cbc2daa0ce2f172819b599c90afa508",
          "executable": false
        },
        {
          "path": "../resource-ownership/starter/ailang/main.ail",
          "destination": "main.ail",
          "sha256": "7de247edd043a37bbe4ff31d0149da540b7dd2d42cc29494150f9dc8bedcf06b",
          "executable": false
        }
      ],
      "carryFiles": [
        "AGENT.md",
        "CHANGELOG.md",
        "_smoke.ail",
        "ailang.lock",
        "ailang.toml",
        "engine.ail",
        "engine_test.ail",
        "examples/qualify_f1.ail",
        "main.ail",
        "HANDOVER.md"
      ],
      "stages": [
        {
          "id": "S1",
          "request": {
            "path": "../resource-ownership/stages/1-file-backing.md",
            "sha256": "22a7a4dd899b7d28910f65a1e961173b0b71f848301fbe670e1ef3ad27c6cf66"
          },
          "publicCheck": {
            "command": [
              "python3",
              "research/real-world-maintenance/taskpacks/v1/resource-ownership/grade_candidate.py",
              "--candidate",
              "{candidate}",
              "--language",
              "ailang",
              "--stage",
              "1",
              "--output",
              "{output}",
              "--expected-source-digest",
              "{candidateDigest}",
              "--command-prefix-json",
              "{commandPrefixJSON}",
              "--containment-qualified",
              "{containmentDigest}"
            ],
            "files": [
              {
                "path": "../resource-ownership/grade_candidate.py",
                "sha256": "259b819fcdee8cbfe37c72a26ae9da2521a56688564b44cc72c21cde33071426"
              },
              {
                "path": "../candidate_grade.py",
                "sha256": "643b8579cb059a5e8ee391fbe789550cd8f7436de669b27c0242d043d2989fd8"
              },
              {
                "path": "../resource-ownership/oracle.py",
                "sha256": "e028365d6def15aa0b89de944b437d4bff39f465c049ef85ce026c0152de2fa8"
              },
              {
                "path": "../resource-ownership/public_check.py",
                "sha256": "7aba7a99a59784217c8244297a4aa75c82c3f202dc19625f7a5c1a343ecf71bf"
              },
              {
                "path": "../resource-ownership/protocol.json",
                "sha256": "a228f90e4f9246f541463ff9782d193b9c9827b7c44d1d763c6c93b06bff8e22"
              },
              {
                "path": "../resource-ownership/fixtures/public.json",
                "sha256": "f2764fb072d7599db6eb7f9fd1bb39f3e6f30ac4dd172484506d9c141ef21ed7"
              },
              {
                "path": "../resource-ownership/fixtures/s0-normal.json",
                "sha256": "c667bcb77f435380ec3e1ce6ff7af3716d0ea336e34afc7dcb5455ef29587816"
              },
              {
                "path": "../resource-ownership/fixtures/s0-reordered.json",
                "sha256": "36046e198726adc06a5e336af5d1b3ab80bf3aabc99ce14f205858563c1611a3"
              },
              {
                "path": "../resource-ownership/fixtures/s1-normal.json",
                "sha256": "c667bcb77f435380ec3e1ce6ff7af3716d0ea336e34afc7dcb5455ef29587816"
              },
              {
                "path": "../resource-ownership/fixtures/s1-reordered.json",
                "sha256": "36046e198726adc06a5e336af5d1b3ab80bf3aabc99ce14f205858563c1611a3"
              },
              {
                "path": "../resource-ownership/fixtures/s2-normal.json",
                "sha256": "149f930860483223704b31e1ab9d5213f1b7dae72826ebb3c9799bb735d0aa2d"
              },
              {
                "path": "../resource-ownership/fixtures/s2-reordered.json",
                "sha256": "869f9d4a2429e960605e0e831e1819094c7eadad56cf459478f28dbebe493411"
              },
              {
                "path": "../resource-ownership/fixtures/s3-normal.json",
                "sha256": "68f017268256e8a733a46eb757ed0b3a5d3530d7176bae6b487dfd5373efb658"
              },
              {
                "path": "../resource-ownership/fixtures/s3-reordered.json",
                "sha256": "f6aabce1399bac0982321963d5b35241b7111337e5952c6905a9033c7396f1c5"
              }
            ]
          },
          "oracle": {
            "command": [
              "python3",
              "research/real-world-maintenance/taskpacks/v1/resource-ownership/grade_candidate.py",
              "--candidate",
              "{candidate}",
              "--language",
              "ailang",
              "--stage",
              "1",
              "--output",
              "{output}",
              "--expected-source-digest",
              "{candidateDigest}",
              "--command-prefix-json",
              "{commandPrefixJSON}",
              "--containment-qualified",
              "{containmentDigest}"
            ],
            "files": [
              {
                "path": "../resource-ownership/grade_candidate.py",
                "sha256": "259b819fcdee8cbfe37c72a26ae9da2521a56688564b44cc72c21cde33071426"
              },
              {
                "path": "../candidate_grade.py",
                "sha256": "643b8579cb059a5e8ee391fbe789550cd8f7436de669b27c0242d043d2989fd8"
              },
              {
                "path": "../resource-ownership/oracle.py",
                "sha256": "e028365d6def15aa0b89de944b437d4bff39f465c049ef85ce026c0152de2fa8"
              },
              {
                "path": "../resource-ownership/public_check.py",
                "sha256": "7aba7a99a59784217c8244297a4aa75c82c3f202dc19625f7a5c1a343ecf71bf"
              },
              {
                "path": "../resource-ownership/protocol.json",
                "sha256": "a228f90e4f9246f541463ff9782d193b9c9827b7c44d1d763c6c93b06bff8e22"
              },
              {
                "path": "../resource-ownership/fixtures/public.json",
                "sha256": "f2764fb072d7599db6eb7f9fd1bb39f3e6f30ac4dd172484506d9c141ef21ed7"
              },
              {
                "path": "../resource-ownership/fixtures/s0-normal.json",
                "sha256": "c667bcb77f435380ec3e1ce6ff7af3716d0ea336e34afc7dcb5455ef29587816"
              },
              {
                "path": "../resource-ownership/fixtures/s0-reordered.json",
                "sha256": "36046e198726adc06a5e336af5d1b3ab80bf3aabc99ce14f205858563c1611a3"
              },
              {
                "path": "../resource-ownership/fixtures/s1-normal.json",
                "sha256": "c667bcb77f435380ec3e1ce6ff7af3716d0ea336e34afc7dcb5455ef29587816"
              },
              {
                "path": "../resource-ownership/fixtures/s1-reordered.json",